{
  "schemaVersion": "1.0.0",
  "snapshotId": "1ea5efd4-f61d-5dfd-a4ce-a305c07ed977",
  "timeSlot": "2026-10-18T12:00:00Z",
  "algorithmVersion": "1.0.0",
  "executionTimeMs": 0.0,
  "matches": [
    {
      "matchId": "5c17783e-839f-5268-9f8f-a8dd3ed38a55",
      "algorithmVersion": "1.0.0",
      "timeSlot": "2026-10-18T12:00:00Z",
      "buyerId": "22222222-2222-4222-8222-222222222222",
      "buyerWallet": "0x0000000000000000000000000000000000000002",
      "sellerId": "11111111-1111-4111-8111-111111111111",
      "sellerWallet": "0x0000000000000000000000000000000000000001",
      "quantityWh": 1870,
      "unitPriceMicrousdPerKwh": 83622,
      "totalAmountMicrousd": 156373,
      "distanceKm": 2.692582403567252,
      "score": 0.5634439310097316,
      "sellerEnergyType": "SOLAR",
      "createdAt": "2026-10-18T22:18:37.515733Z"
    }
  ],
  "unmatchedBuyerIds": [],
  "warnings": []
}
