{
  "schemaVersion": "1.0.0",
  "snapshotId": "55555555-5555-4555-8555-555555555555",
  "timeSlot": "2026-10-17T14:00:00Z",
  "algorithmVersion": "1.0.0",
  "executionTimeMs": 2.5,

  "matches": [
    {
      "matchId": "66666666-6666-4666-8666-666666666666",
      "algorithmVersion": "1.0.0",
      "timeSlot": "2026-10-17T14:00:00Z",

      "buyerId": "22222222-2222-4222-8222-222222222222",
      "buyerWallet": "0x2222222222222222222222222222222222222222",

      "sellerId": "11111111-1111-4111-8111-111111111111",
      "sellerWallet": "0x1111111111111111111111111111111111111111",

      "quantityWh": 4000,
      "unitPriceMicrousdPerKwh": 140000,
      "totalAmountMicrousd": 560000,

      "distanceKm": 2.692582403567252,
      "score": 0.673626616381407,

      "sellerEnergyType": "SOLAR",
      "createdAt": "2026-10-17T14:00:01Z"
    }
  ],

  "unmatchedBuyerIds": [],
  "warnings": []
}
